key,locale,text,context,variables,review_state,source_content_ids,release_marked
loc:later_han/locality/be013/name,ko-KR,광한현,Later Han locality name; 廣漢縣; audited source cell BE13,,approved,locality:later_han/be013,true
loc:later_han/locality/be014/name,ko-KR,덕양현,Later Han locality name; 德陽縣; audited source cell BE14,,approved,locality:later_han/be014,true
loc:later_han/locality/bf004/name,ko-KR,성도현,Later Han locality name; 成都縣; audited source cell BF4,,approved,locality:later_han/bf004,true
loc:later_han/locality/bf005/name,ko-KR,비현,Later Han locality name; 郫縣; audited source cell BF5,,approved,locality:later_han/bf005,true
loc:later_han/locality/bf006/name,ko-KR,강원현,Later Han locality name; 江原縣; audited source cell BF6,,approved,locality:later_han/bf006,true
loc:later_han/locality/bf007/name,ko-KR,번현,Later Han locality name; 繁縣; audited source cell BF7,,approved,locality:later_han/bf007,true
loc:later_han/locality/bf008/name,ko-KR,광도현,Later Han locality name; 廣都縣; audited source cell BF8,,approved,locality:later_han/bf008,true
loc:later_han/locality/bf009/name,ko-KR,임공현,Later Han locality name; 臨邛縣; audited source cell BF9,,approved,locality:later_han/bf009,true
loc:later_han/locality/bf010/name,ko-KR,전저도,Later Han locality name; 湔氐道; audited source cell BF10,,approved,locality:later_han/bf010,true
loc:later_han/locality/bf011/name,ko-KR,문강도,Later Han locality name; 汶江道; audited source cell BF11,,approved,locality:later_han/bf011,true
loc:later_han/locality/bf012/name,ko-KR,팡릉현,Later Han locality name; 八陵縣; audited source cell BF12,,approved,locality:later_han/bf012,true
loc:later_han/locality/bf013/name,ko-KR,광유현,Later Han locality name; 廣柔縣; audited source cell BF13,,approved,locality:later_han/bf013,true
loc:later_han/locality/bf014/name,ko-KR,면사도,Later Han locality name; 綿虒道; audited source cell BF14,,approved,locality:later_han/bf014,true
loc:later_han/locality/bg004/name,ko-KR,무양현,Later Han locality name; 武陽縣; audited source cell BG4,,approved,locality:later_han/bg004,true
loc:later_han/locality/bg005/name,ko-KR,자중현,Later Han locality name; 資中縣; audited source cell BG5,,approved,locality:later_han/bg005,true
loc:later_han/locality/bg006/name,ko-KR,우비현,Later Han locality name; 牛鞞縣; audited source cell BG6,,approved,locality:later_han/bg006,true
loc:later_han/locality/bg007/name,ko-KR,남안현,Later Han locality name; 南安縣; audited source cell BG7,,approved,locality:later_han/bg007,true
loc:later_han/locality/bg008/name,ko-KR,북도,Later Han locality name; 僰道; audited source cell BG8,,approved,locality:later_han/bg008,true
loc:later_han/locality/bg009/name,ko-KR,강양현,Later Han locality name; 江陽縣; audited source cell BG9,,approved,locality:later_han/bg009,true
loc:later_han/locality/bg010/name,ko-KR,절현,Later Han locality name; 節縣; audited source cell BG10,,approved,locality:later_han/bg010,true
loc:later_han/locality/bg011/name,ko-KR,남광현,Later Han locality name; 南廣縣; audited source cell BG11,,approved,locality:later_han/bg011,true
loc:later_han/locality/bg012/name,ko-KR,한안현,Later Han locality name; 漢安縣; audited source cell BG12,,approved,locality:later_han/bg012,true
loc:later_han/locality/bh004/name,ko-KR,고차란현,Later Han locality name; 故且蘭縣; audited source cell BH4,,approved,locality:later_han/bh004,true
loc:later_han/locality/bh005/name,ko-KR,평이현,Later Han locality name; 平夷縣; audited source cell BH5,,approved,locality:later_han/bh005,true
loc:later_han/locality/bh006/name,ko-KR,폐현,Later Han locality name; 鄨縣; audited source cell BH6,,approved,locality:later_han/bh006,true
loc:later_han/locality/bh007/name,ko-KR,무렴현,Later Han locality name; 毋斂縣; audited source cell BH7,,approved,locality:later_han/bh007,true
loc:later_han/locality/bh008/name,ko-KR,담지현,Later Han locality name; 談指縣; audited source cell BH8,,approved,locality:later_han/bh008,true
loc:later_han/locality/bh009/name,ko-KR,야랑현,Later Han locality name; 夜郞縣; audited source cell BH9,,approved,locality:later_han/bh009,true
loc:later_han/locality/bh010/name,ko-KR,동병현,Later Han locality name; 同並縣; audited source cell BH10,,approved,locality:later_han/bh010,true
loc:later_han/locality/bh011/name,ko-KR,담고현,Later Han locality name; 談稿縣; audited source cell BH11,,approved,locality:later_han/bh011,true
loc:later_han/locality/bh012/name,ko-KR,누강현,Later Han locality name; 漏江縣; audited source cell BH12,,approved,locality:later_han/bh012,true
loc:later_han/locality/bh013/name,ko-KR,무단현,Later Han locality name; 毋單縣; audited source cell BH13,,approved,locality:later_han/bh013,true
loc:later_han/locality/bh014/name,ko-KR,완온현,Later Han locality name; 宛溫縣; audited source cell BH14,,approved,locality:later_han/bh014,true
loc:later_han/locality/bh015/name,ko-KR,심봉현,Later Han locality name; 鐔封縣; audited source cell BH15,,approved,locality:later_han/bh015,true
loc:later_han/locality/bh016/name,ko-KR,누와현,Later Han locality name; 漏臥縣; audited source cell BH16,,approved,locality:later_han/bh016,true
loc:later_han/locality/bh017/name,ko-KR,구정현,Later Han locality name; 句町縣; audited source cell BH17,,approved,locality:later_han/bh017,true
loc:later_han/locality/bh018/name,ko-KR,진승현,Later Han locality name; 進乘縣; audited source cell BH18,,approved,locality:later_han/bh018,true
loc:later_han/locality/bh019/name,ko-KR,서수현,Later Han locality name; 西隨縣; audited source cell BH19,,approved,locality:later_han/bh019,true
loc:later_han/locality/bi004/name,ko-KR,공도현,Later Han locality name; 邛都縣; audited source cell BI4,,approved,locality:later_han/bi004,true
loc:later_han/locality/bi005/name,ko-KR,수구현,Later Han locality name; 遂久縣; audited source cell BI5,,approved,locality:later_han/bi005,true
loc:later_han/locality/bi006/name,ko-KR,영관도,Later Han locality name; 靈關道; audited source cell BI6,,approved,locality:later_han/bi006,true
loc:later_han/locality/bi007/name,ko-KR,대등현,Later Han locality name; 臺登縣; audited source cell BI7,,approved,locality:later_han/bi007,true
loc:later_han/locality/bi008/name,ko-KR,청령현,Later Han locality name; 青蛉縣; audited source cell BI8,,approved,locality:later_han/bi008,true
loc:later_han/locality/bi009/name,ko-KR,비수현,Later Han locality name; 卑水縣; audited source cell BI9,,approved,locality:later_han/bi009,true
loc:later_han/locality/bi010/name,ko-KR,삼봉현,Later Han locality name; 三縫縣; audited source cell BI10,,approved,locality:later_han/bi010,true
loc:later_han/locality/bi011/name,ko-KR,회무현,Later Han locality name; 會無縣; audited source cell BI11,,approved,locality:later_han/bi011,true
loc:later_han/locality/bi012/name,ko-KR,정작현,Later Han locality name; 定莋縣; audited source cell BI12,,approved,locality:later_han/bi012,true
loc:later_han/locality/bi013/name,ko-KR,천현,Later Han locality name; 闡縣; audited source cell BI13,,approved,locality:later_han/bi013,true
loc:later_han/locality/bi014/name,ko-KR,소시현,Later Han locality name; 蘇示縣; audited source cell BI14,,approved,locality:later_han/bi014,true
loc:later_han/locality/bi015/name,ko-KR,대작현,Later Han locality name; 大莋縣; audited source cell BI15,,approved,locality:later_han/bi015,true
loc:later_han/locality/bi016/name,ko-KR,작진현,Later Han locality name; 莋秦縣; audited source cell BI16,,approved,locality:later_han/bi016,true
loc:later_han/locality/bi017/name,ko-KR,고복현,Later Han locality name; 姑復縣; audited source cell BI17,,approved,locality:later_han/bi017,true
loc:later_han/locality/bj004/name,ko-KR,전지현,Later Han locality name; 滇池縣; audited source cell BJ4,,approved,locality:later_han/bj004,true
loc:later_han/locality/bj005/name,ko-KR,승휴현,Later Han locality name; 勝休縣; audited source cell BJ5,,approved,locality:later_han/bj005,true
loc:later_han/locality/bj006/name,ko-KR,유원현,Later Han locality name; 俞元縣; audited source cell BJ6,,approved,locality:later_han/bj006,true
loc:later_han/locality/bj007/name,ko-KR,율고현,Later Han locality name; 律高縣; audited source cell BJ7,,approved,locality:later_han/bj007,true
loc:later_han/locality/bj008/name,ko-KR,분고현,Later Han locality name; 贲古縣; audited source cell BJ8,,approved,locality:later_han/bj008,true
loc:later_han/locality/bj009/name,ko-KR,무절현,Later Han locality name; 毋棳縣; audited source cell BJ9,,approved,locality:later_han/bj009,true
loc:later_han/locality/bj010/name,ko-KR,건령현,Later Han locality name; 建伶縣; audited source cell BJ10,,approved,locality:later_han/bj010,true
loc:later_han/locality/bj011/name,ko-KR,곡창현,Later Han locality name; 穀昌縣; audited source cell BJ11,,approved,locality:later_han/bj011,true
loc:later_han/locality/bj012/name,ko-KR,목미현,Later Han locality name; 牧靡縣; audited source cell BJ12,,approved,locality:later_han/bj012,true
loc:later_han/locality/bj013/name,ko-KR,미현,Later Han locality name; 味縣; audited source cell BJ13,,approved,locality:later_han/bj013,true
loc:later_han/locality/bj014/name,ko-KR,곤택현,Later Han locality name; 昆澤縣; audited source cell BJ14,,approved,locality:later_han/bj014,true
loc:later_han/locality/bj015/name,ko-KR,동뢰현,Later Han locality name; 同瀨縣; audited source cell BJ15,,approved,locality:later_han/bj015,true
loc:later_han/locality/bj016/name,ko-KR,동로현,Later Han locality name; 同勞縣; audited source cell BJ16,,approved,locality:later_han/bj016,true
loc:later_han/locality/bj017/name,ko-KR,쌍백현,Later Han locality name; 雙栢縣; audited source cell BJ17,,approved,locality:later_han/bj017,true
loc:later_han/locality/bj018/name,ko-KR,연연현,Later Han locality name; 連然縣; audited source cell BJ18,,approved,locality:later_han/bj018,true
loc:later_han/locality/bj019/name,ko-KR,농동현,Later Han locality name; 弄棟縣; audited source cell BJ19,,approved,locality:later_han/bj019,true
loc:later_han/locality/bj020/name,ko-KR,진장현,Later Han locality name; 秦臧縣; audited source cell BJ20,,approved,locality:later_han/bj020,true
loc:later_han/locality/bk004/name,ko-KR,불위현,Later Han locality name; 不韋縣; audited source cell BK4,,approved,locality:later_han/bk004,true
loc:later_han/locality/bk005/name,ko-KR,휴당현,Later Han locality name; 巂唐縣; audited source cell BK5,,reviewed,locality:later_han/bk005,false
loc:later_han/locality/bk006/name,ko-KR,비소현,Later Han locality name; 比蘇縣; audited source cell BK6,,approved,locality:later_han/bk006,true
loc:later_han/locality/bk007/name,ko-KR,접유현,Later Han locality name; 楪楡縣; audited source cell BK7,,approved,locality:later_han/bk007,true
loc:later_han/locality/bk008/name,ko-KR,사룡현,Later Han locality name; 邪龍縣; audited source cell BK8,,approved,locality:later_han/bk008,true
loc:later_han/locality/bk009/name,ko-KR,운남현,Later Han locality name; 雲南縣; audited source cell BK9,,approved,locality:later_han/bk009,true
loc:later_han/locality/bk010/name,ko-KR,애뢰현,Later Han locality name; 哀牢縣; audited source cell BK10,,approved,locality:later_han/bk010,true
loc:later_han/locality/bk011/name,ko-KR,박남현,Later Han locality name; 博南縣; audited source cell BK11,,approved,locality:later_han/bk011,true
loc:later_han/locality/bo004/name,ko-KR,적도,Later Han locality name; 狄道; audited source cell BO4,,approved,locality:later_han/bo004,true
loc:later_han/locality/bo005/name,ko-KR,안고현,Later Han locality name; 安故縣; audited source cell BO5,,approved,locality:later_han/bo005,true
loc:later_han/locality/bo006/name,ko-KR,저도,Later Han locality name; 氐道; audited source cell BO6,,approved,locality:later_han/bo006,true
loc:later_han/locality/bo007/name,ko-KR,수양현,Later Han locality name; 首陽縣; audited source cell BO7,,approved,locality:later_han/bo007,true
loc:later_han/locality/bo008/name,ko-KR,대하현,Later Han locality name; 大夏縣; audited source cell BO8,,approved,locality:later_han/bo008,true
loc:later_han/locality/bo009/name,ko-KR,양무현,Later Han locality name; 襄武縣; audited source cell BO9,,approved,locality:later_han/bo009,true
loc:later_han/locality/bo010/name,ko-KR,임조현,Later Han locality name; 臨洮縣; audited source cell BO10,,approved,locality:later_han/bo010,true
loc:later_han/locality/bo011/name,ko-KR,포한현,Later Han locality name; 枹罕縣; audited source cell BO11,,approved,locality:later_han/bo011,true
loc:later_han/locality/bo012/name,ko-KR,백석현,Later Han locality name; 白石縣; audited source cell BO12,,approved,locality:later_han/bo012,true
loc:later_han/locality/bo013/name,ko-KR,장현,Later Han locality name; 鄣縣; audited source cell BO13,,approved,locality:later_han/bo013,true
loc:later_han/locality/bo014/name,ko-KR,하관현,Later Han locality name; 河關縣; audited source cell BO14,,approved,locality:later_han/bo014,true
loc:later_han/locality/bp004/name,ko-KR,기현,Later Han locality name; 冀縣; audited source cell BP4,,approved,locality:later_han/bp004,true
loc:later_han/locality/bp005/name,ko-KR,망항현,Later Han locality name; 望恒縣; audited source cell BP5,,approved,locality:later_han/bp005,true
loc:later_han/locality/bp006/name,ko-KR,아양현,Later Han locality name; 阿陽縣; audited source cell BP6,,approved,locality:later_han/bp006,true
loc:later_han/locality/bp007/name,ko-KR,약양현,Later Han locality name; 略陽縣; audited source cell BP7,,approved,locality:later_han/bp007,true
loc:later_han/locality/bp008/name,ko-KR,용사현,Later Han locality name; 勇士縣; audited source cell BP8,,approved,locality:later_han/bp008,true
loc:later_han/locality/bp009/name,ko-KR,성기현,Later Han locality name; 成紀縣; audited source cell BP9,,approved,locality:later_han/bp009,true
loc:later_han/locality/bp010/name,ko-KR,농현,Later Han locality name; 隴縣; audited source cell BP10,,approved,locality:later_han/bp010,true
loc:later_han/locality/bp011/name,ko-KR,원도,Later Han locality name; 豲道; audited source cell BP11,,approved,locality:later_han/bp011,true
loc:later_han/locality/bp012/name,ko-KR,난간현,Later Han locality name; 蘭干縣; audited source cell BP12,,approved,locality:later_han/bp012,true
loc:later_han/locality/bp013/name,ko-KR,평양현,Later Han locality name; 平襄縣; audited source cell BP13,,approved,locality:later_han/bp013,true
loc:later_han/locality/bp014/name,ko-KR,현친현,Later Han locality name; 顯親縣; audited source cell BP14,,approved,locality:later_han/bp014,true
loc:later_han/locality/bp015/name,ko-KR,상규현,Later Han locality name; 上邽縣; audited source cell BP15,,approved,locality:later_han/bp015,true
loc:later_han/locality/bp016/name,ko-KR,서현,Later Han locality name; 西縣; audited source cell BP16,,approved,locality:later_han/bp016,true
loc:later_han/locality/bq004/name,ko-KR,하변현,Later Han locality name; 下辨縣; audited source cell BQ4,,approved,locality:later_han/bq004,true
loc:later_han/locality/bq005/name,ko-KR,무도도,Later Han locality name; 武都道; audited source cell BQ5,,approved,locality:later_han/bq005,true
loc:later_han/locality/bq006/name,ko-KR,상록현,Later Han locality name; 上祿縣; audited source cell BQ6,,approved,locality:later_han/bq006,true
loc:later_han/locality/bq007/name,ko-KR,고도,Later Han locality name; 故道; audited source cell BQ7,,approved,locality:later_han/bq007,true
loc:later_han/locality/bq008/name,ko-KR,하지현,Later Han locality name; 河池縣; audited source cell BQ8,,approved,locality:later_han/bq008,true
loc:later_han/locality/bq009/name,ko-KR,저현,Later Han locality name; 沮縣; audited source cell BQ9,,approved,locality:later_han/bq009,true
loc:later_han/locality/bq010/name,ko-KR,강도,Later Han locality name; 羌道; audited source cell BQ10,,approved,locality:later_han/bq010,true
loc:later_han/locality/br004/name,ko-KR,윤오현,Later Han locality name; 允吾縣; audited source cell BR4,,approved,locality:later_han/br004,true
loc:later_han/locality/br005/name,ko-KR,호미현,Later Han locality name; 浩亹縣; audited source cell BR5,,approved,locality:later_han/br005,true
loc:later_han/locality/br006/name,ko-KR,영거현,Later Han locality name; 令居縣; audited source cell BR6,,approved,locality:later_han/br006,true
loc:later_han/locality/br007/name,ko-KR,지양현,Later Han locality name; 枝陽縣; audited source cell BR7,,approved,locality:later_han/br007,true
loc:later_han/locality/br008/name,ko-KR,금성현,Later Han locality name; 金城縣; audited source cell BR8,,approved,locality:later_han/br008,true
loc:later_han/locality/br009/name,ko-KR,유중현,Later Han locality name; 楡中縣; audited source cell BR9,,approved,locality:later_han/br009,true
loc:later_han/locality/br010/name,ko-KR,임강현,Later Han locality name; 臨羌縣; audited source cell BR10,,approved,locality:later_han/br010,true
loc:later_han/locality/br011/name,ko-KR,파강현,Later Han locality name; 破羌縣; audited source cell BR11,,approved,locality:later_han/br011,true
loc:later_han/locality/br012/name,ko-KR,안이현,Later Han locality name; 安夷縣; audited source cell BR12,,approved,locality:later_han/br012,true
loc:later_han/locality/br013/name,ko-KR,윤가현,Later Han locality name; 允街縣; audited source cell BR13,,approved,locality:later_han/br013,true
loc:later_han/locality/bs004/name,ko-KR,임경현,Later Han locality name; 臨涇縣; audited source cell BS4,,approved,locality:later_han/bs004,true
loc:later_han/locality/bs005/name,ko-KR,고평현,Later Han locality name; 高平縣; audited source cell BS5,,approved,locality:later_han/bs005,true
loc:later_han/locality/bs006/name,ko-KR,조나현,Later Han locality name; 朝那縣; audited source cell BS6,,approved,locality:later_han/bs006,true
loc:later_han/locality/bs007/name,ko-KR,오지현,Later Han locality name; 烏枝縣; audited source cell BS7,,approved,locality:later_han/bs007,true
loc:later_han/locality/bs008/name,ko-KR,삼수현,Later Han locality name; 三水縣; audited source cell BS8,,approved,locality:later_han/bs008,true
loc:later_han/locality/bs009/name,ko-KR,음반현,Later Han locality name; 陰盤縣; audited source cell BS9,,approved,locality:later_han/bs009,true
loc:later_han/locality/bs010/name,ko-KR,팽양현,Later Han locality name; 彭陽縣; audited source cell BS10,,approved,locality:later_han/bs010,true
loc:later_han/locality/bs011/name,ko-KR,순고현,Later Han locality name; 鶉觚縣; audited source cell BS11,,approved,locality:later_han/bs011,true
loc:later_han/locality/bt004/name,ko-KR,부평현,Later Han locality name; 富平縣; audited source cell BT4,,approved,locality:later_han/bt004,true
loc:later_han/locality/bt005/name,ko-KR,니양현,Later Han locality name; 泥陽縣; audited source cell BT5,,approved,locality:later_han/bt005,true
loc:later_han/locality/bt006/name,ko-KR,익거현,Later Han locality name; 弋居縣; audited source cell BT6,,approved,locality:later_han/bt006,true
loc:later_han/locality/bt007/name,ko-KR,렴현,Later Han locality name; 廉縣; audited source cell BT7,,approved,locality:later_han/bt007,true
loc:later_han/locality/bt008/name,ko-KR,삼련현,Later Han locality name; 參䜌縣; audited source cell BT8,,approved,locality:later_han/bt008,true
loc:later_han/locality/bt009/name,ko-KR,영주현,Later Han locality name; 靈州縣; audited source cell BT9,,approved,locality:later_han/bt009,true
loc:later_han/locality/bu004/name,ko-KR,고장현,Later Han locality name; 姑臧縣; audited source cell BU4,,approved,locality:later_han/bu004,true
loc:later_han/locality/bu005/name,ko-KR,장액현,Later Han locality name; 張掖縣; audited source cell BU5,,approved,locality:later_han/bu005,true
loc:later_han/locality/bu006/name,ko-KR,무위현,Later Han locality name; 武威縣; audited source cell BU6,,approved,locality:later_han/bu006,true
loc:later_han/locality/bu007/name,ko-KR,휴도현,Later Han locality name; 休屠縣; audited source cell BU7,,approved,locality:later_han/bu007,true
loc:later_han/locality/bu008/name,ko-KR,서차현,Later Han locality name; 揟次縣; audited source cell BU8,,approved,locality:later_han/bu008,true
loc:later_han/locality/bu009/name,ko-KR,난조현,Later Han locality name; 鸞鳥縣; audited source cell BU9,,approved,locality:later_han/bu009,true
loc:later_han/locality/bu010/name,ko-KR,박환현,Later Han locality name; 樸𠟼縣; audited source cell BU10,,reviewed,locality:later_han/bu010,false
loc:later_han/locality/bu011/name,ko-KR,온위현,Later Han locality name; 媼圍縣; audited source cell BU11,,approved,locality:later_han/bu011,true
loc:later_han/locality/bu012/name,ko-KR,선위현,Later Han locality name; 宣威縣; audited source cell BU12,,approved,locality:later_han/bu012,true
loc:later_han/locality/bu013/name,ko-KR,창송현,Later Han locality name; 倉松縣; audited source cell BU13,,approved,locality:later_han/bu013,true
loc:later_han/locality/bu014/name,ko-KR,전음현,Later Han locality name; 鸇陰縣; audited source cell BU14,,approved,locality:later_han/bu014,true
loc:later_han/locality/bu015/name,ko-KR,조려현,Later Han locality name; 租厲縣; audited source cell BU15,,approved,locality:later_han/bu015,true
loc:later_han/locality/bu016/name,ko-KR,현미현,Later Han locality name; 顯美縣; audited source cell BU16,,approved,locality:later_han/bu016,true
loc:later_han/locality/bu017/name,ko-KR,좌기현,Later Han locality name; 左騎縣; audited source cell BU17,,approved,locality:later_han/bu017,true
loc:later_han/locality/bv004/name,ko-KR,역득현,Later Han locality name; 觻得縣; audited source cell BV4,,approved,locality:later_han/bv004,true
loc:later_han/locality/bv005/name,ko-KR,소무현,Later Han locality name; 昭武縣; audited source cell BV5,,approved,locality:later_han/bv005,true
loc:later_han/locality/bv006/name,ko-KR,산단현,Later Han locality name; 刪丹縣; audited source cell BV6,,approved,locality:later_han/bv006,true
loc:later_han/locality/bv007/name,ko-KR,저지현,Later Han locality name; 氐池縣; audited source cell BV7,,approved,locality:later_han/bv007,true
loc:later_han/locality/bv008/name,ko-KR,옥란현,Later Han locality name; 屋蘭縣; audited source cell BV8,,approved,locality:later_han/bv008,true
loc:later_han/locality/bv009/name,ko-KR,일륵현,Later Han locality name; 日勒縣; audited source cell BV9,,approved,locality:later_han/bv009,true
loc:later_han/locality/bv010/name,ko-KR,여간현,Later Han locality name; 驪靬縣; audited source cell BV10,,approved,locality:later_han/bv010,true
loc:later_han/locality/bv011/name,ko-KR,번화현,Later Han locality name; 番和縣; audited source cell BV11,,approved,locality:later_han/bv011,true
loc:later_han/locality/bw004/name,ko-KR,복록현,Later Han locality name; 福祿縣; audited source cell BW4,,approved,locality:later_han/bw004,true
loc:later_han/locality/bw005/name,ko-KR,표씨현,Later Han locality name; 表氏縣; audited source cell BW5,,approved,locality:later_han/bw005,true
loc:later_han/locality/bw006/name,ko-KR,낙관현,Later Han locality name; 樂涫縣; audited source cell BW6,,approved,locality:later_han/bw006,true
loc:later_han/locality/bw007/name,ko-KR,옥문현,Later Han locality name; 玉門縣; audited source cell BW7,,approved,locality:later_han/bw007,true
loc:later_han/locality/bw008/name,ko-KR,회수현,Later Han locality name; 會水縣; audited source cell BW8,,approved,locality:later_han/bw008,true
loc:later_han/locality/bw009/name,ko-KR,사두현,Later Han locality name; 沙頭縣; audited source cell BW9,,approved,locality:later_han/bw009,true
loc:later_han/locality/bw010/name,ko-KR,안미현,Later Han locality name; 安彌縣; audited source cell BW10,,approved,locality:later_han/bw010,true
loc:later_han/locality/bw011/name,ko-KR,건제현,Later Han locality name; 乾齊縣; audited source cell BW11,,approved,locality:later_han/bw011,true
loc:later_han/locality/bw012/name,ko-KR,연수현,Later Han locality name; 延壽縣; audited source cell BW12,,approved,locality:later_han/bw012,true
loc:later_han/locality/bx004/name,ko-KR,돈황현,Later Han locality name; 敦煌縣; audited source cell BX4,,approved,locality:later_han/bx004,true
loc:later_han/locality/bx005/name,ko-KR,명안현,Later Han locality name; 冥安縣; audited source cell BX5,,approved,locality:later_han/bx005,true
loc:later_han/locality/bx006/name,ko-KR,효곡현,Later Han locality name; 效穀縣; audited source cell BX6,,approved,locality:later_han/bx006,true
loc:later_han/locality/bx007/name,ko-KR,병천현,Later Han locality name; 拼泉縣; audited source cell BX7,,approved,locality:later_han/bx007,true
loc:later_han/locality/bx008/name,ko-KR,광지현,Later Han locality name; 廣至縣; audited source cell BX8,,approved,locality:later_han/bx008,true
loc:later_han/locality/bx009/name,ko-KR,용륵현,Later Han locality name; 龍勒縣; audited source cell BX9,,approved,locality:later_han/bx009,true
loc:later_han/locality/ca004/name,ko-KR,장자현,Later Han locality name; 長子縣; audited source cell CA4,,approved,locality:later_han/ca004,true
loc:later_han/locality/ca005/name,ko-KR,둔류현,Later Han locality name; 屯留縣; audited source cell CA5,,approved,locality:later_han/ca005,true
loc:later_han/locality/ca006/name,ko-KR,동제현,Later Han locality name; 銅鞮縣; audited source cell CA6,,approved,locality:later_han/ca006,true
loc:later_han/locality/ca007/name,ko-KR,점현,Later Han locality name; 沾縣; audited source cell CA7,,approved,locality:later_han/ca007,true
