key,locale,text,context,variables,review_state,source_content_ids,release_marked
loc:later_han/locality/as005/name,ko-KR,영릉현,Later Han locality name; 零陵縣; audited source cell AS5,,approved,locality:later_han/as005,true
loc:later_han/locality/as006/name,ko-KR,영도현,Later Han locality name; 營道縣; audited source cell AS6,,approved,locality:later_han/as006,true
loc:later_han/locality/as007/name,ko-KR,영포현,Later Han locality name; 營浦縣; audited source cell AS7,,approved,locality:later_han/as007,true
loc:later_han/locality/as008/name,ko-KR,영도현,Later Han locality name; 泠道縣; audited source cell AS8,,approved,locality:later_han/as008,true
loc:later_han/locality/as009/name,ko-KR,조양현,Later Han locality name; 洮陽縣; audited source cell AS9,,approved,locality:later_han/as009,true
loc:later_han/locality/as010/name,ko-KR,도양현,Later Han locality name; 都梁縣; audited source cell AS10,,approved,locality:later_han/as010,true
loc:later_han/locality/as011/name,ko-KR,부이후국,Later Han locality name; 夫夷侯國; audited source cell AS11,,approved,locality:later_han/as011,true
loc:later_han/locality/as012/name,ko-KR,시안후국,Later Han locality name; 始安侯國; audited source cell AS12,,approved,locality:later_han/as012,true
loc:later_han/locality/as013/name,ko-KR,중안후국,Later Han locality name; 重安侯國; audited source cell AS13,,approved,locality:later_han/as013,true
loc:later_han/locality/as014/name,ko-KR,상향현,Later Han locality name; 湘鄉縣; audited source cell AS14,,approved,locality:later_han/as014,true
loc:later_han/locality/as015/name,ko-KR,소양후국,Later Han locality name; 昭陽侯國; audited source cell AS15,,approved,locality:later_han/as015,true
loc:later_han/locality/as016/name,ko-KR,증양후국,Later Han locality name; 烝陽侯國; audited source cell AS16,,approved,locality:later_han/as016,true
loc:later_han/locality/at004/name,ko-KR,침현,Later Han locality name; 郴縣; audited source cell AT4,,approved,locality:later_han/at004,true
loc:later_han/locality/at005/name,ko-KR,편현,Later Han locality name; 便縣; audited source cell AT5,,approved,locality:later_han/at005,true
loc:later_han/locality/at006/name,ko-KR,뇌양현,Later Han locality name; 耒陽縣; audited source cell AT6,,approved,locality:later_han/at006,true
loc:later_han/locality/at007/name,ko-KR,음산현,Later Han locality name; 陰山縣; audited source cell AT7,,approved,locality:later_han/at007,true
loc:later_han/locality/at008/name,ko-KR,남평현,Later Han locality name; 南平縣; audited source cell AT8,,approved,locality:later_han/at008,true
loc:later_han/locality/at009/name,ko-KR,임무현,Later Han locality name; 臨武縣; audited source cell AT9,,approved,locality:later_han/at009,true
loc:later_han/locality/at010/name,ko-KR,계양현,Later Han locality name; 桂陽縣; audited source cell AT10,,approved,locality:later_han/at010,true
loc:later_han/locality/at011/name,ko-KR,함광현,Later Han locality name; 含洭縣; audited source cell AT11,,approved,locality:later_han/at011,true
loc:later_han/locality/at012/name,ko-KR,정양현,Later Han locality name; 湞陽縣; audited source cell AT12,,approved,locality:later_han/at012,true
loc:later_han/locality/at013/name,ko-KR,곡강현,Later Han locality name; 曲江縣; audited source cell AT13,,approved,locality:later_han/at013,true
loc:later_han/locality/at014/name,ko-KR,한영현,Later Han locality name; 漢寧縣; audited source cell AT14,,approved,locality:later_han/at014,true
loc:later_han/locality/au004/name,ko-KR,임원현,Later Han locality name; 臨沅縣; audited source cell AU4,,approved,locality:later_han/au004,true
loc:later_han/locality/au005/name,ko-KR,한수현,Later Han locality name; 漢壽縣; audited source cell AU5,,approved,locality:later_han/au005,true
loc:later_han/locality/au006/name,ko-KR,잔릉현,Later Han locality name; 孱陵縣; audited source cell AU6,,approved,locality:later_han/au006,true
loc:later_han/locality/au007/name,ko-KR,영양현,Later Han locality name; 零陽縣; audited source cell AU7,,approved,locality:later_han/au007,true
loc:later_han/locality/au008/name,ko-KR,충현,Later Han locality name; 充縣; audited source cell AU8,,approved,locality:later_han/au008,true
loc:later_han/locality/au009/name,ko-KR,원릉현,Later Han locality name; 沅陵縣; audited source cell AU9,,approved,locality:later_han/au009,true
loc:later_han/locality/au010/name,ko-KR,진양현,Later Han locality name; 辰陽縣; audited source cell AU10,,approved,locality:later_han/au010,true
loc:later_han/locality/au011/name,ko-KR,유양현,Later Han locality name; 酉陽縣; audited source cell AU11,,approved,locality:later_han/au011,true
loc:later_han/locality/au012/name,ko-KR,천릉현,Later Han locality name; 遷陵縣; audited source cell AU12,,approved,locality:later_han/au012,true
loc:later_han/locality/au013/name,ko-KR,심성현,Later Han locality name; 鐔成縣; audited source cell AU13,,approved,locality:later_han/au013,true
loc:later_han/locality/au014/name,ko-KR,원남현,Later Han locality name; 沅南縣; audited source cell AU14,,approved,locality:later_han/au014,true
loc:later_han/locality/au015/name,ko-KR,작당현,Later Han locality name; 作唐縣; audited source cell AU15,,approved,locality:later_han/au015,true
loc:later_han/locality/av004/name,ko-KR,임상현,Later Han locality name; 臨湘縣; audited source cell AV4,,approved,locality:later_han/av004,true
loc:later_han/locality/av005/name,ko-KR,유현,Later Han locality name; 攸縣; audited source cell AV5,,approved,locality:later_han/av005,true
loc:later_han/locality/av006/name,ko-KR,도릉현,Later Han locality name; 荼陵縣; audited source cell AV6,,approved,locality:later_han/av006,true
loc:later_han/locality/av007/name,ko-KR,안성현,Later Han locality name; 安城縣; audited source cell AV7,,approved,locality:later_han/av007,true
loc:later_han/locality/av008/name,ko-KR,령현,Later Han locality name; 酃縣; audited source cell AV8,,approved,locality:later_han/av008,true
loc:later_han/locality/av009/name,ko-KR,상남후국,Later Han locality name; 湘南侯國; audited source cell AV9,,approved,locality:later_han/av009,true
loc:later_han/locality/av010/name,ko-KR,연도현,Later Han locality name; 連道縣; audited source cell AV10,,approved,locality:later_han/av010,true
loc:later_han/locality/av011/name,ko-KR,소릉현,Later Han locality name; 昭陵縣; audited source cell AV11,,approved,locality:later_han/av011,true
loc:later_han/locality/av012/name,ko-KR,익양현,Later Han locality name; 益陽縣; audited source cell AV12,,approved,locality:later_han/av012,true
loc:later_han/locality/av013/name,ko-KR,하준현,Later Han locality name; 下雋縣; audited source cell AV13,,approved,locality:later_han/av013,true
loc:later_han/locality/av014/name,ko-KR,나현,Later Han locality name; 羅縣; audited source cell AV14,,approved,locality:later_han/av014,true
loc:later_han/locality/av015/name,ko-KR,예릉현,Later Han locality name; 醴陵縣; audited source cell AV15,,approved,locality:later_han/av015,true
loc:later_han/locality/av016/name,ko-KR,용릉현,Later Han locality name; 容陵縣; audited source cell AV16,,approved,locality:later_han/av016,true
loc:later_han/locality/aw004/name,ko-KR,음릉현,Later Han locality name; 陰陵縣; audited source cell AW4,,approved,locality:later_han/aw004,true
loc:later_han/locality/aw005/name,ko-KR,수춘현,Later Han locality name; 壽春縣; audited source cell AW5,,approved,locality:later_han/aw005,true
loc:later_han/locality/aw006/name,ko-KR,준주현,Later Han locality name; 浚遒縣; audited source cell AW6,,approved,locality:later_han/aw006,true
loc:later_han/locality/aw007/name,ko-KR,성덕현,Later Han locality name; 成德縣; audited source cell AW7,,approved,locality:later_han/aw007,true
loc:later_han/locality/aw008/name,ko-KR,서곡양현,Later Han locality name; 西曲陽縣; audited source cell AW8,,approved,locality:later_han/aw008,true
loc:later_han/locality/aw009/name,ko-KR,합비후국,Later Han locality name; 合肥侯國; audited source cell AW9,,approved,locality:later_han/aw009,true
loc:later_han/locality/aw010/name,ko-KR,역양후국,Later Han locality name; 歷陽侯國; audited source cell AW10,,approved,locality:later_han/aw010,true
loc:later_han/locality/aw011/name,ko-KR,당도현,Later Han locality name; 當塗縣; audited source cell AW11,,approved,locality:later_han/aw011,true
loc:later_han/locality/aw012/name,ko-KR,전초현,Later Han locality name; 全椒縣; audited source cell AW12,,approved,locality:later_han/aw012,true
loc:later_han/locality/aw013/name,ko-KR,종리후국,Later Han locality name; 鍾離侯國; audited source cell AW13,,approved,locality:later_han/aw013,true
loc:later_han/locality/aw014/name,ko-KR,부릉현,Later Han locality name; 阜陵縣; audited source cell AW14,,approved,locality:later_han/aw014,true
loc:later_han/locality/aw015/name,ko-KR,하채현,Later Han locality name; 下蔡縣; audited source cell AW15,,approved,locality:later_han/aw015,true
loc:later_han/locality/aw016/name,ko-KR,평아현,Later Han locality name; 平阿縣; audited source cell AW16,,approved,locality:later_han/aw016,true
loc:later_han/locality/aw017/name,ko-KR,의성현,Later Han locality name; 義成縣; audited source cell AW17,,approved,locality:later_han/aw017,true
loc:later_han/locality/ax004/name,ko-KR,완릉현,Later Han locality name; 宛陵縣; audited source cell AX4,,approved,locality:later_han/ax004,true
loc:later_han/locality/ax005/name,ko-KR,율양현,Later Han locality name; 溧陽縣; audited source cell AX5,,approved,locality:later_han/ax005,true
loc:later_han/locality/ax006/name,ko-KR,단양현,Later Han locality name; 丹陽縣; audited source cell AX6,,approved,locality:later_han/ax006,true
loc:later_han/locality/ax007/name,ko-KR,고장현,Later Han locality name; 故鄣縣; audited source cell AX7,,approved,locality:later_han/ax007,true
loc:later_han/locality/ax008/name,ko-KR,어잠현,Later Han locality name; 於潛縣; audited source cell AX8,,approved,locality:later_han/ax008,true
loc:later_han/locality/ax009/name,ko-KR,경현,Later Han locality name; 涇縣; audited source cell AX9,,approved,locality:later_han/ax009,true
loc:later_han/locality/ax010/name,ko-KR,흡현,Later Han locality name; 歙縣; audited source cell AX10,,approved,locality:later_han/ax010,true
loc:later_han/locality/ax011/name,ko-KR,유현,Later Han locality name; 黝縣; audited source cell AX11,,approved,locality:later_han/ax011,true
loc:later_han/locality/ax012/name,ko-KR,능양현,Later Han locality name; 陵陽縣; audited source cell AX12,,approved,locality:later_han/ax012,true
loc:later_han/locality/ax013/name,ko-KR,무호현,Later Han locality name; 蕪湖縣; audited source cell AX13,,approved,locality:later_han/ax013,true
loc:later_han/locality/ax014/name,ko-KR,말릉현,Later Han locality name; 秣陵縣; audited source cell AX14,,approved,locality:later_han/ax014,true
loc:later_han/locality/ax015/name,ko-KR,호숙후국,Later Han locality name; 湖熟侯國; audited source cell AX15,,approved,locality:later_han/ax015,true
loc:later_han/locality/ax016/name,ko-KR,구용현,Later Han locality name; 句容縣; audited source cell AX16,,approved,locality:later_han/ax016,true
loc:later_han/locality/ax017/name,ko-KR,강승현,Later Han locality name; 江乘縣; audited source cell AX17,,approved,locality:later_han/ax017,true
loc:later_han/locality/ax018/name,ko-KR,춘곡현,Later Han locality name; 春穀縣; audited source cell AX18,,approved,locality:later_han/ax018,true
loc:later_han/locality/ax019/name,ko-KR,석성현,Later Han locality name; 石城縣; audited source cell AX19,,approved,locality:later_han/ax019,true
loc:later_han/locality/ay004/name,ko-KR,서현,Later Han locality name; 舒縣; audited source cell AY4,,approved,locality:later_han/ay004,true
loc:later_han/locality/ay005/name,ko-KR,우루후국,Later Han locality name; 雩婁侯國; audited source cell AY5,,approved,locality:later_han/ay005,true
loc:later_han/locality/ay006/name,ko-KR,심양현,Later Han locality name; 尋陽縣; audited source cell AY6,,approved,locality:later_han/ay006,true
loc:later_han/locality/ay007/name,ko-KR,잠현,Later Han locality name; 潛縣; audited source cell AY7,,approved,locality:later_han/ay007,true
loc:later_han/locality/ay008/name,ko-KR,임호후국,Later Han locality name; 臨湖侯國; audited source cell AY8,,approved,locality:later_han/ay008,true
loc:later_han/locality/ay009/name,ko-KR,용서후국,Later Han locality name; 龍舒侯國; audited source cell AY9,,approved,locality:later_han/ay009,true
loc:later_han/locality/ay010/name,ko-KR,양안현,Later Han locality name; 襄安縣; audited source cell AY10,,approved,locality:later_han/ay010,true
loc:later_han/locality/ay011/name,ko-KR,환현,Later Han locality name; 晥縣; audited source cell AY11,,approved,locality:later_han/ay011,true
loc:later_han/locality/ay012/name,ko-KR,거소후국,Later Han locality name; 居巢侯國; audited source cell AY12,,approved,locality:later_han/ay012,true
loc:later_han/locality/ay013/name,ko-KR,육안국,Later Han locality name; 六安國; audited source cell AY13,,approved,locality:later_han/ay013,true
loc:later_han/locality/ay014/name,ko-KR,요후국,Later Han locality name; 蓼侯國; audited source cell AY14,,approved,locality:later_han/ay014,true
loc:later_han/locality/ay015/name,ko-KR,안풍현,Later Han locality name; 安豐縣; audited source cell AY15,,approved,locality:later_han/ay015,true
loc:later_han/locality/ay016/name,ko-KR,양천후국,Later Han locality name; 陽泉侯國; audited source cell AY16,,approved,locality:later_han/ay016,true
loc:later_han/locality/ay017/name,ko-KR,안풍후국,Later Han locality name; 安風侯國; audited source cell AY17,,approved,locality:later_han/ay017,true
loc:later_han/locality/az004/name,ko-KR,산음현,Later Han locality name; 山陰縣; audited source cell AZ4,,approved,locality:later_han/az004,true
loc:later_han/locality/az005/name,ko-KR,무현,Later Han locality name; 鄮縣; audited source cell AZ5,,approved,locality:later_han/az005,true
loc:later_han/locality/az006/name,ko-KR,오상현,Later Han locality name; 烏傷縣; audited source cell AZ6,,approved,locality:later_han/az006,true
loc:later_han/locality/az007/name,ko-KR,제기현,Later Han locality name; 諸暨縣; audited source cell AZ7,,approved,locality:later_han/az007,true
loc:later_han/locality/az008/name,ko-KR,여기현,Later Han locality name; 餘暨縣; audited source cell AZ8,,approved,locality:later_han/az008,true
loc:later_han/locality/az009/name,ko-KR,태말현,Later Han locality name; 太末縣; audited source cell AZ9,,approved,locality:later_han/az009,true
loc:later_han/locality/az010/name,ko-KR,상우현,Later Han locality name; 上虞縣; audited source cell AZ10,,approved,locality:later_han/az010,true
loc:later_han/locality/az011/name,ko-KR,섬현,Later Han locality name; 剡縣; audited source cell AZ11,,approved,locality:later_han/az011,true
loc:later_han/locality/az012/name,ko-KR,여요현,Later Han locality name; 餘姚縣; audited source cell AZ12,,approved,locality:later_han/az012,true
loc:later_han/locality/az013/name,ko-KR,구장현,Later Han locality name; 句章縣; audited source cell AZ13,,approved,locality:later_han/az013,true
loc:later_han/locality/az014/name,ko-KR,은현,Later Han locality name; 鄞縣; audited source cell AZ14,,approved,locality:later_han/az014,true
loc:later_han/locality/az015/name,ko-KR,장안현,Later Han locality name; 章安縣; audited source cell AZ15,,approved,locality:later_han/az015,true
loc:later_han/locality/az016/name,ko-KR,영녕현,Later Han locality name; 永寧縣; audited source cell AZ16,,approved,locality:later_han/az016,true
loc:later_han/locality/az017/name,ko-KR,동부후국,Later Han locality name; 東部侯國; audited source cell AZ17,,approved,locality:later_han/az017,true
loc:later_han/locality/ba004/name,ko-KR,오현,Later Han locality name; 吳縣; audited source cell BA4,,approved,locality:later_han/ba004,true
loc:later_han/locality/ba005/name,ko-KR,해염현,Later Han locality name; 海鹽縣; audited source cell BA5,,approved,locality:later_han/ba005,true
loc:later_han/locality/ba006/name,ko-KR,오정현,Later Han locality name; 烏程縣; audited source cell BA6,,approved,locality:later_han/ba006,true
loc:later_han/locality/ba007/name,ko-KR,여항현,Later Han locality name; 餘杭縣; audited source cell BA7,,approved,locality:later_han/ba007,true
loc:later_han/locality/ba008/name,ko-KR,비릉현,Later Han locality name; 毗陵縣; audited source cell BA8,,approved,locality:later_han/ba008,true
loc:later_han/locality/ba009/name,ko-KR,단도현,Later Han locality name; 丹徒縣; audited source cell BA9,,approved,locality:later_han/ba009,true
loc:later_han/locality/ba010/name,ko-KR,곡아현,Later Han locality name; 曲阿縣; audited source cell BA10,,approved,locality:later_han/ba010,true
loc:later_han/locality/ba011/name,ko-KR,유권현,Later Han locality name; 由拳縣; audited source cell BA11,,approved,locality:later_han/ba011,true
loc:later_han/locality/ba012/name,ko-KR,안현,Later Han locality name; 安縣; audited source cell BA12,,approved,locality:later_han/ba012,true
loc:later_han/locality/ba013/name,ko-KR,부춘현,Later Han locality name; 富春縣; audited source cell BA13,,approved,locality:later_han/ba013,true
loc:later_han/locality/ba014/name,ko-KR,양이읍,Later Han locality name; 陽羨邑; audited source cell BA14,,approved,locality:later_han/ba014,true
loc:later_han/locality/ba015/name,ko-KR,무석후국,Later Han locality name; 無錫侯國; audited source cell BA15,,approved,locality:later_han/ba015,true
loc:later_han/locality/ba016/name,ko-KR,루현,Later Han locality name; 婁縣; audited source cell BA16,,approved,locality:later_han/ba016,true
loc:later_han/locality/bb004/name,ko-KR,남창현,Later Han locality name; 南昌縣; audited source cell BB4,,approved,locality:later_han/bb004,true
loc:later_han/locality/bb005/name,ko-KR,건성현,Later Han locality name; 建城縣; audited source cell BB5,,approved,locality:later_han/bb005,true
loc:later_han/locality/bb006/name,ko-KR,신감현,Later Han locality name; 新淦縣; audited source cell BB6,,approved,locality:later_han/bb006,true
loc:later_han/locality/bb007/name,ko-KR,의춘현,Later Han locality name; 宜春縣; audited source cell BB7,,approved,locality:later_han/bb007,true
loc:later_han/locality/bb008/name,ko-KR,여릉현,Later Han locality name; 廬陵縣; audited source cell BB8,,approved,locality:later_han/bb008,true
loc:later_han/locality/bb009/name,ko-KR,공현,Later Han locality name; 贛縣; audited source cell BB9,,approved,locality:later_han/bb009,true
loc:later_han/locality/bb010/name,ko-KR,우도현,Later Han locality name; 雩都縣; audited source cell BB10,,approved,locality:later_han/bb010,true
loc:later_han/locality/bb011/name,ko-KR,남야현,Later Han locality name; 南野縣; audited source cell BB11,,approved,locality:later_han/bb011,true
loc:later_han/locality/bb012/name,ko-KR,남성현,Later Han locality name; 南城縣; audited source cell BB12,,approved,locality:later_han/bb012,true
loc:later_han/locality/bb013/name,ko-KR,파양현,Later Han locality name; 鄱陽縣; audited source cell BB13,,approved,locality:later_han/bb013,true
loc:later_han/locality/bb014/name,ko-KR,역릉현,Later Han locality name; 歷陵縣; audited source cell BB14,,approved,locality:later_han/bb014,true
loc:later_han/locality/bb015/name,ko-KR,여한현,Later Han locality name; 餘汗縣; audited source cell BB15,,reviewed,locality:later_han/bb015,false
loc:later_han/locality/bb016/name,ko-KR,교양현,Later Han locality name; 鄡陽縣; audited source cell BB16,,approved,locality:later_han/bb016,true
loc:later_han/locality/bb017/name,ko-KR,팽택현,Later Han locality name; 彭澤縣; audited source cell BB17,,approved,locality:later_han/bb017,true
loc:later_han/locality/bb018/name,ko-KR,시상현,Later Han locality name; 柴桑縣; audited source cell BB18,,approved,locality:later_han/bb018,true
loc:later_han/locality/bb019/name,ko-KR,애현,Later Han locality name; 艾縣; audited source cell BB19,,approved,locality:later_han/bb019,true
loc:later_han/locality/bb020/name,ko-KR,해혼후국,Later Han locality name; 海昏侯國; audited source cell BB20,,approved,locality:later_han/bb020,true
loc:later_han/locality/bb021/name,ko-KR,평도후국,Later Han locality name; 平都侯國; audited source cell BB21,,approved,locality:later_han/bb021,true
loc:later_han/locality/bb022/name,ko-KR,석양현,Later Han locality name; 石陽縣; audited source cell BB22,,approved,locality:later_han/bb022,true
loc:later_han/locality/bb023/name,ko-KR,임여현,Later Han locality name; 臨汝縣; audited source cell BB23,,approved,locality:later_han/bb023,true
loc:later_han/locality/bb024/name,ko-KR,건창현,Later Han locality name; 建昌縣; audited source cell BB24,,approved,locality:later_han/bb024,true
loc:later_han/locality/bc004/name,ko-KR,남정현,Later Han locality name; 南鄭縣; audited source cell BC4,,approved,locality:later_han/bc004,true
loc:later_han/locality/bc005/name,ko-KR,성고현,Later Han locality name; 成固縣; audited source cell BC5,,approved,locality:later_han/bc005,true
loc:later_han/locality/bc006/name,ko-KR,서성현,Later Han locality name; 西城縣; audited source cell BC6,,approved,locality:later_han/bc006,true
loc:later_han/locality/bc007/name,ko-KR,포중현,Later Han locality name; 褒中縣; audited source cell BC7,,approved,locality:later_han/bc007,true
loc:later_han/locality/bc008/name,ko-KR,면양현,Later Han locality name; 沔陽縣; audited source cell BC8,,approved,locality:later_han/bc008,true
loc:later_han/locality/bc009/name,ko-KR,안양현,Later Han locality name; 安陽縣; audited source cell BC9,,approved,locality:later_han/bc009,true
loc:later_han/locality/bc010/name,ko-KR,석현,Later Han locality name; 錫縣; audited source cell BC10,,approved,locality:later_han/bc010,true
loc:later_han/locality/bc011/name,ko-KR,상용현,Later Han locality name; 上庸縣; audited source cell BC11,,approved,locality:later_han/bc011,true
loc:later_han/locality/bc012/name,ko-KR,방릉현,Later Han locality name; 房陵縣; audited source cell BC12,,approved,locality:later_han/bc012,true
loc:later_han/locality/bd004/name,ko-KR,강주현,Later Han locality name; 江州縣; audited source cell BD4,,approved,locality:later_han/bd004,true
loc:later_han/locality/bd005/name,ko-KR,탕거현,Later Han locality name; 宕渠縣; audited source cell BD5,,approved,locality:later_han/bd005,true
loc:later_han/locality/bd006/name,ko-KR,구인현,Later Han locality name; 朐忍縣; audited source cell BD6,,approved,locality:later_han/bd006,true
loc:later_han/locality/bd007/name,ko-KR,낭중현,Later Han locality name; 閬中縣; audited source cell BD7,,approved,locality:later_han/bd007,true
loc:later_han/locality/bd008/name,ko-KR,어복현,Later Han locality name; 魚復縣; audited source cell BD8,,approved,locality:later_han/bd008,true
loc:later_han/locality/bd009/name,ko-KR,임강현,Later Han locality name; 臨江縣; audited source cell BD9,,approved,locality:later_han/bd009,true
loc:later_han/locality/bd010/name,ko-KR,지현,Later Han locality name; 枳縣; audited source cell BD10,,approved,locality:later_han/bd010,true
loc:later_han/locality/bd011/name,ko-KR,부릉현,Later Han locality name; 涪陵縣; audited source cell BD11,,approved,locality:later_han/bd011,true
loc:later_han/locality/bd012/name,ko-KR,점강현,Later Han locality name; 墊江縣; audited source cell BD12,,approved,locality:later_han/bd012,true
loc:later_han/locality/bd013/name,ko-KR,안한현,Later Han locality name; 安漢縣; audited source cell BD13,,approved,locality:later_han/bd013,true
loc:later_han/locality/bd014/name,ko-KR,평도현,Later Han locality name; 平都縣; audited source cell BD14,,approved,locality:later_han/bd014,true
loc:later_han/locality/bd015/name,ko-KR,충국현,Later Han locality name; 充國縣; audited source cell BD15,,approved,locality:later_han/bd015,true
loc:later_han/locality/bd016/name,ko-KR,선한현,Later Han locality name; 宣漢縣; audited source cell BD16,,approved,locality:later_han/bd016,true
loc:later_han/locality/bd017/name,ko-KR,한창현,Later Han locality name; 漢昌縣; audited source cell BD17,,approved,locality:later_han/bd017,true
loc:later_han/locality/be004/name,ko-KR,낙현,Later Han locality name; 雒縣; audited source cell BE4,,approved,locality:later_han/be004,true
loc:later_han/locality/be005/name,ko-KR,신도현,Later Han locality name; 新都縣; audited source cell BE5,,approved,locality:later_han/be005,true
loc:later_han/locality/be006/name,ko-KR,면죽현,Later Han locality name; 綿竹縣; audited source cell BE6,,approved,locality:later_han/be006,true
loc:later_han/locality/be007/name,ko-KR,십방현,Later Han locality name; 什邡縣; audited source cell BE7,,approved,locality:later_han/be007,true
loc:later_han/locality/be008/name,ko-KR,부현,Later Han locality name; 涪縣; audited source cell BE8,,approved,locality:later_han/be008,true
loc:later_han/locality/be009/name,ko-KR,재동현,Later Han locality name; 梓潼縣; audited source cell BE9,,approved,locality:later_han/be009,true
loc:later_han/locality/be010/name,ko-KR,백수현,Later Han locality name; 白水縣; audited source cell BE10,,approved,locality:later_han/be010,true
loc:later_han/locality/be011/name,ko-KR,가맹현,Later Han locality name; 葭萌縣; audited source cell BE11,,approved,locality:later_han/be011,true
loc:later_han/locality/be012/name,ko-KR,처현,Later Han locality name; 郪縣; audited source cell BE12,,approved,locality:later_han/be012,true
